hash,symbol,desc,dt,attchmntFile,sm_name,sm_isin,an_dt,sort_date,seq_id,smIndustry,orgid,attchmntText,bflag,old_new,csvName,exchdisstime,difference,fileSize
8294e201e577461a50f3730a57795512,MGEL,Shareholders meeting,23062025163231,https://nsearchives.nseindia.com/corporate/MGEL_23062025163216_INTIMATIONFORAGMRD.pdf,Mangalam Global Enterprise Limited,INE0APB01016,2025-06-23 16:32:31,2025-06-23 16:32:31,,,,"Mangalam Global Enterprise Limited has informed the Exchange about Intimation of 15th Annual General Meeting (AGM), of the Comapny.",,,,23-Jun-2025 16:32:31,00:00:00,829 KB
d40ba9b04b30a794acac4ad6c26cfd1a,SKMEGGPROD,Change in Directors/ Key Managerial Personnel/ Auditor/ Compliance Officer/ Share Transfer Agent,23062025163341,https://nsearchives.nseindia.com/corporate/xbrl/CIM_58275_1469697_23062025043341_WEB.xml,SKM Egg Products Export (India) Limited,INE411D01015,2025-06-23 16:33:41,2025-06-23 16:33:41,,Food And Food Processing,,SKM EGG PRODUCTS EXPORT (INDIA) LIMITED has informed the Exchange about Change in Directors/ Key Managerial Personnel/ Auditor/ Compliance Officer/ Share Transfer Agent,,,,23-Jun-2025 16:33:43,00:00:02,3 KB
2563f79ffe89cba7acc8dd3a9c44c0aa,YASHO,Analysts/Institutional Investor Meet/Con. Call Updates,23062025163438,https://nsearchives.nseindia.com/corporate/8291904474_23062025163421_intimation_IM.pdf,Yasho Industries Limited,INE616Z01012,2025-06-23 16:34:38,2025-06-23 16:34:38,,,,Yasho Industries Limited has informed the Exchange about Schedule of meet,,,,23-Jun-2025 16:34:38,00:00:00,479 KB
d64d808757ef32be090a71cfeed22765,MGEL,Record Date,23062025163457,https://nsearchives.nseindia.com/corporate/MGEL_23062025163402_INTIMATIONFORAGMRD.pdf,Mangalam Global Enterprise Limited,INE0APB01016,2025-06-23 16:34:57,2025-06-23 16:34:57,,,,Mangalam Global Enterprise Limited has informed the Exchange that Record date for the purpose of Dividend  is 18-Jul-2025.,,,,23-Jun-2025 16:34:57,00:00:00,829 KB
9dcfa348f7a88f2c3ec2be65d6fe72cd,PRITIKAUTO,General Updates,23062025163459,https://nsearchives.nseindia.com/corporate/PRITIKAUTO_23062025163256_INTIMATIONOFSTEPDOWNSUBSIDIARY.pdf,Pritika Auto Industries Limited,INE583R01029,2025-06-23 16:34:59,2025-06-23 16:34:59,,,,Pritika Auto Industries Limited has informed the Exchange about investment by the Subsidiary Company,,,,23-Jun-2025 16:35:00,00:00:01,1.68 MB
196f9203e4c9aec67bffa323615c6bb1,VENUSPIPES,Credit Rating- Revision,23062025163525,https://nsearchives.nseindia.com/corporate/VENUSPIPES_23062025163504_Intimation_credit_rating23625.pdf,Venus Pipes & Tubes Limited,INE0JA001018,2025-06-23 16:35:25,2025-06-23 16:35:25,,,,Venus Pipes & Tubes Limited has informed the Exchange about Credit Rating- Revision,,,,23-Jun-2025 16:35:26,00:00:01,749 KB
2ae33e2699d34eeeac4d1363d7ec538b,CGCL,Trading Window-XBRL,23062025163534,https://nsearchives.nseindia.com/corporate/xbrl/CLOSURE_TRADING_WINDOW_1469701_23062025043534_WEB.xml,Capri Global Capital Limited,INE180C01018,2025-06-23 16:35:34,2025-06-23 16:35:34,,,,Capri Global Capital Limited has informed the Exchange about Closure of Trading Window,,,,23-Jun-2025 16:35:35,00:00:01,2 KB
fd73178b37ed1ba04e9eff6389874b3b,KPITTECH,General Updates,23062025163554,https://nsearchives.nseindia.com/corporate/KPITTECH_23062025163400_MidQtrUpdate_Signed.pdf,KPIT Technologies Limited,INE04I401011,2025-06-23 16:35:54,2025-06-23 16:35:54,,,,KPIT Technologies Limited has informed the Exchange about Mid Quarter Update - June 2025.,,,,23-Jun-2025 16:35:55,00:00:01,861 KB
910adcc6701a6d3bc05b666be0362cd2,CSLFINANCE,Change in Management,23062025163736,https://nsearchives.nseindia.com/corporate/CSLFINANCELIMITED_23062025163719_Resignation_Intimation_Stock_Exchanges.pdf,CSL Finance Limited,INE718F01018,2025-06-23 16:37:36,2025-06-23 16:37:36,,,,CSL Finance Limited has informed the Exchange about change in Management,,,,23-Jun-2025 16:37:37,00:00:01,323 KB
0178e9f14e3a4eff1bb59e4d513919b8,VSSL,General Updates,23062025163903,https://nsearchives.nseindia.com/corporate/VSSL_23062025163727_VSSL.pdf,Vardhman Special Steels Limited,INE050M01012,2025-06-23 16:39:03,2025-06-23 16:39:03,,Steel And Steel Products,,Vardhman Special Steels Limited has informed the Exchange about Intimation under regulation 30 of SEBI LODR Regulations 2015.,,,,23-Jun-2025 16:39:04,00:00:01,883 KB
57ac7f190a2540df23ed3be552b821cc,BGRENERGY,General Updates,23062025163950,https://nsearchives.nseindia.com/corporate/BGRENERGYSYS_23062025163908_BGR_RECTIFICATION_ORDER_SD.pdf,BGR Energy Systems Limited,INE661I01014,2025-06-23 16:39:50,2025-06-23 16:39:50,,Engineering,,BGR Energy Systems Limited has informed the Exchange about General Updates,,,,23-Jun-2025 16:39:51,00:00:01,466 KB
92082487ae12fd6c0aaf32e35298138c,MGEL,General Updates,23062025163954,https://nsearchives.nseindia.com/corporate/MGEL_23062025163937_BMOUTCOME23062025.pdf,Mangalam Global Enterprise Limited,INE0APB01016,2025-06-23 16:39:54,2025-06-23 16:39:54,,,,Mangalam Global Enterprise Limited has informed the Exchange about Appointment of M/s. RPSS & Co as a Secretarial Auditors for a term of five (5) consecutive years.,,,,23-Jun-2025 16:39:55,00:00:01,1.97 MB
e96e004f83fa779ca0d5b889b19f4d69,MGEL,Change in Directors/ Key Managerial Personnel/ Auditor/ Compliance Officer/ Share Transfer Agent,23062025164137,https://nsearchives.nseindia.com/corporate/xbrl/CIM_58276_1469703_23062025044136_WEB.xml,Mangalam Global Enterprise Limited,INE0APB01016,2025-06-23 16:41:37,2025-06-23 16:41:37,,,,MANGALAM GLOBAL ENTERPRISE LIMITED has informed the Exchange about Change in Directors/ Key Managerial Personnel/ Auditor/ Compliance Officer/ Share Transfer Agent,,,,23-Jun-2025 16:41:38,00:00:01,4 KB
e71622ed7b32ea3073a7776e76024837,CSLFINANCE,Change in Directors/ Key Managerial Personnel/ Auditor/ Compliance Officer/ Share Transfer Agent,23062025164150,https://nsearchives.nseindia.com/corporate/xbrl/CIM_58277_1469706_23062025044149_WEB.xml,CSL Finance Limited,INE718F01018,2025-06-23 16:41:50,2025-06-23 16:41:50,,,,CSL FINANCE LIMITED has informed the Exchange about Change in Directors/ Key Managerial Personnel/ Auditor/ Compliance Officer/ Share Transfer Agent,,,,23-Jun-2025 16:41:51,00:00:01,3 KB
fe4b24b6b63dcf8a30d27599aa4d76af,MANINFRA,Analysts/Institutional Investor Meet/Con. Call Updates,23062025164333,https://nsearchives.nseindia.com/corporate/vishaladhav_23062025164248_MICL.pdf,Man Infraconstruction Limited,INE949H01015,2025-06-23 16:43:33,2025-06-23 16:43:33,,Construction,,"Man Infraconstruction Limited has informed the Exchange about Cancellation of Analyst/Institutional Investors meeting scheduled on June 25, 2025.",,,,23-Jun-2025 16:43:33,00:00:00,385 KB
1b535ccec1f65bc35b0380b158e4a186,SUMEETINDS,Trading Window,23062025164452,https://nsearchives.nseindia.com/corporate/SUMEETINDS_23062025164445_Windowclosue30062025.pdf,Sumeet Industries Limited,INE235C01010,2025-06-23 16:44:52,2025-06-23 16:44:52,,Textile Products,,"Sumeet Industries Limited has informed the Exchange regarding the Trading Window closure pursuant to SEBI (Prohibition of Insider Trading) Regulations, 2015",,,,23-Jun-2025 16:44:53,00:00:01,165 KB
89dceba376ef2a03819c349d12303bd9,VSTTILLERS,Trading Window,23062025164550,https://nsearchives.nseindia.com/corporate/VSTTILLERS_23062025164528_TWC.pdf,V.S.T Tillers Tractors Limited,INE764D01017,2025-06-23 16:45:50,2025-06-23 16:45:50,,Automobiles - 4 Wheelers,,"V.S.T Tillers Tractors Limited has informed the Exchange regarding the Trading Window closure pursuant to SEBI (Prohibition of Insider Trading) Regulations, 2015",,,,23-Jun-2025 16:45:51,00:00:01,148 KB
5776e33c0fa66563ee25192d6a984c9d,ITI,General Updates,23062025164601,https://nsearchives.nseindia.com/corporate/ITI_23062025164528_SE_Intimation.pdf,ITI Limited,INE248A01017,2025-06-23 16:46:01,2025-06-23 16:46:01,,Telecommunication - Equipment,,ITI Limited has informed the Exchange about General Updates,,,,23-Jun-2025 16:46:03,00:00:02,735 KB
451b788eda6d1ab6dcf4f225eba7b90c,BAJAJHIND,Trading Window,23062025164658,https://nsearchives.nseindia.com/corporate/BAJAJNEAPS1_23062025164619_SE_Intimation_Closure_of_Trading_Window_23062025.pdf,Bajaj Hindusthan Sugar Limited,INE306A01021,2025-06-23 16:46:58,2025-06-23 16:46:58,,Sugar,,"Bajaj Hindusthan Sugar Limited has informed the Exchange regarding the Trading Window closure pursuant to SEBI (Prohibition of Insider Trading) Regulations, 2015",,,,23-Jun-2025 16:46:59,00:00:01,263 KB
46012f53ba4357afbfb94d98736ed0b6,SHAREINDIA,Allotment of Securities,23062025164754,https://nsearchives.nseindia.com/corporate/SISL_23062025164716_Reg30allotment23062025.pdf,Share India Securities Limited,INE932X01018,2025-06-23 16:47:54,2025-06-23 16:47:54,,,,"Please be informed that the Finance Committee of the Board of Directors of the Company at their meeting held today i.e., on June 23, 2025, has approved the allotment of 9,990 Secured, Listed, Rated, Taxable, Transferable, Redeemable, Fully paid-up Non-Convertible Debentures on Private Placement Basis.",,,,23-Jun-2025 16:47:54,00:00:00,869 KB
c5c8f94847a53df63708a6c51b403dd7,VSTIND,Trading Window,23062025164905,https://nsearchives.nseindia.com/corporate/VSTIND_23062025164832_CTW30062025.pdf,VST Industries Limited,INE710A01016,2025-06-23 16:49:05,2025-06-23 16:49:05,,Cigarettes,,"VST Industries Limited has informed the Exchange regarding the Trading Window closure pursuant to SEBI (Prohibition of Insider Trading) Regulations, 2015",,,,23-Jun-2025 16:49:07,00:00:02,246 KB
9399774fc5d25f7ec4531096c9da4792,GVPTECH,Copy of Newspaper Publication,23062025164909,https://nsearchives.nseindia.com/corporate/4THDIM_23062025164855_IntimationNewspaper_advSigned.pdf,GVP Infotech Limited,INE382T01030,2025-06-23 16:49:09,2025-06-23 16:49:09,,,,GVP Infotech Limited has informed the Exchange about Copy of Newspaper Publication,,,,23-Jun-2025 16:49:09,00:00:00,16.68 MB
3b64dd5e901e444a0656f6f2d46752d7,UNOMINDA,ESOP/ESOS/ESPS,23062025165012,https://nsearchives.nseindia.com/corporate/MINDAIND1_23062025165004_Intimation_ESOP.pdf,UNO Minda Limited,INE405E01023,2025-06-23 16:50:12,2025-06-23 16:50:12,,,,UNO Minda Limited has informed the Exchange regarding Allotment of 358757 Equity Shares under Employee Stock Option Scheme 2019,,,,23-Jun-2025 16:50:13,00:00:01,1.02 MB
a33a6c60d6527b6a8f9995f86182621e,BAJAJHIND,Trading Window-XBRL,23062025165218,https://nsearchives.nseindia.com/corporate/xbrl/CLOSURE_TRADING_WINDOW_1469713_23062025045217_WEB.xml,Bajaj Hindusthan Sugar Limited,INE306A01021,2025-06-23 16:52:18,2025-06-23 16:52:18,,Sugar,,Bajaj Hindusthan Sugar Limited has informed the Exchange about Closure of Trading Window,,,,23-Jun-2025 16:52:19,00:00:01,2 KB
3a27b85ef1ac6696bc7c6cf4aea96cdd,AVANTEL,Shareholders meeting,23062025165253,https://nsearchives.nseindia.com/corporate/AVANTEL_23062025164916_VotingResults23062025Signed.pdf,Avantel Limited,INE005B01027,2025-06-23 16:52:53,2025-06-23 16:52:53,,,,"Avantel Limited has submitted the Exchange a copy of Srutinizers report of  Annual General Meeting held on Jun 23, 2025 along with a copy of minutes.",,,,23-Jun-2025 16:52:53,00:00:00,5.59 MB
a6d0563c2d0bb2c268dd3f888e8e3907,SHAREINDIA,Alteration Of Capital and Fund Raising-XBRL,23062025165259,https://nsearchives.nseindia.com/corporate/xbrl/ALTERATION_OF_CAPITAL_AND_FUND_RAISING_1469714_23062025045258_WEB.xml,Share India Securities Limited,INE932X01018,2025-06-23 16:52:59,2025-06-23 16:52:59,,,,Share India Securities Limited has informed the Exchange regarding Allotment of Securities,,,,23-Jun-2025 16:53:00,00:00:01,4 KB
a20a63ce7b34c09d7ac8981246b08488,ASMS,Copy of Newspaper Publication,23062025165319,https://nsearchives.nseindia.com/corporate/BARTRONICS1_23062025165309_Intimation_of_newspaper_advertisment_to_stock_exchange.pdf,Bartronics India Limited,INE855F01042,2025-06-23 16:53:19,2025-06-23 16:53:19,,,,Bartronics India Limited has informed the Exchange about Copy of Newspaper Publication,,,,23-Jun-2025 16:53:20,00:00:01,9.15 MB
239554d993ebf4ee484106d6cbdd6aea,VSTIND,Trading Window-XBRL,23062025165354,https://nsearchives.nseindia.com/corporate/xbrl/CLOSURE_TRADING_WINDOW_1469716_23062025045354_WEB.xml,VST Industries Limited,INE710A01016,2025-06-23 16:53:54,2025-06-23 16:53:54,,Cigarettes,,VST INDUSTRIES LIMITED has informed the Exchange about Closure of Trading Window,,,,23-Jun-2025 16:53:55,00:00:01,2 KB
8099957c7da811d0598e0abea418b5a5,ASMS,Notice Of Shareholders Meetings-XBRL,23062025165402,https://nsearchives.nseindia.com/corporate/xbrl/NOTICE_OF_SHAREHOLDERS_MEETINGS_1469717_23062025045401_WEB.xml,Bartronics India Limited,INE855F01042,2025-06-23 16:54:02,2025-06-23 16:54:02,,,,BARTRONICS INDIA LIMITED has informed the Exchange about Notice of Shareholders Meeting for Postal Ballot,,,,23-Jun-2025 16:54:02,00:00:00,7 KB
c41a0fc78e28f96f9d350330518d078e,GSFC,Investor Presentation,23062025165515,https://nsearchives.nseindia.com/corporate/GSFC_23062025165505_letterinvestormeet.pdf,Gujarat State Fertilizers & Chemicals Limited,INE026A01017,2025-06-23 16:55:15,2025-06-23 16:55:15,,Fertilisers,,Gujarat State Fertilizers & Chemicals Limited has informed the Exchange about Investor Presentation,,,,23-Jun-2025 16:55:16,00:00:01,1.41 MB
7b2ee242fbeedb4c3e2a61119356107d,VSTTILLERS,Trading Window-XBRL,23062025165534,https://nsearchives.nseindia.com/corporate/xbrl/CLOSURE_TRADING_WINDOW_1469719_23062025045533_WEB.xml,V.S.T Tillers Tractors Limited,INE764D01017,2025-06-23 16:55:34,2025-06-23 16:55:34,,Automobiles - 4 Wheelers,,V.S.T TILLERS TRACTORS LIMITED has informed the Exchange about Closure of Trading Window,,,,23-Jun-2025 16:55:35,00:00:01,2 KB
bbbbb9f300dccfa2050bf4b570284f71,GVPTECH,Rights Issue,23062025165622,https://nsearchives.nseindia.com/corporate/4THDIM_23062025165614_Outcome.pdf,GVP Infotech Limited,INE382T01030,2025-06-23 16:56:22,2025-06-23 16:56:22,,,,"GVPTECH: GVP Infotech Limited has informed the Exchange that Board of Directors at its meeting held on Jun 23, 2025, has decided to issue equity shares on rights basis in the ratio of 13:100, Issue of 2,11,72,007 Equity Shares of face value of Rs. 2.00/- each for cash at an Issue Price of Rs. 10.00/- per Equity Share aggregating up to Rs. 21,17,20,070/- to all the eligible equity shareholders of the Company on Rights ( Rights Issue ) as on the Record date Monday, 30th June, 2025.",,,,23-Jun-2025 16:56:23,00:00:01,706 KB
9ebeca7c1aa278294079881576dbec06,KITEX,Change in Directors/ Key Managerial Personnel/ Auditor/ Compliance Officer/ Share Transfer Agent,23062025165648,https://nsearchives.nseindia.com/corporate/xbrl/CIM_58278_1469723_23062025045647_WEB.xml,Kitex Garments Limited,INE602G01020,2025-06-23 16:56:48,2025-06-23 16:56:48,,Textile Products,,KITEX GARMENTS LIMITED has informed the Exchange about Change in Directors/ Key Managerial Personnel/ Auditor/ Compliance Officer/ Share Transfer Agent,,,,23-Jun-2025 16:56:49,00:00:01,6 KB
32857fa03f93d47413d8b53975666092,HBSL,Updates,23062025165650,https://nsearchives.nseindia.com/corporate/HBSL_23062025165626_Intimation.pdf,HB Stockholdings Limited,INE550B01022,2025-06-23 16:56:50,2025-06-23 16:56:50,,,,"HB Stockholdings Limited has informed the Exchange regarding 'update on the intimation dated June 18, 2025'.",,,,23-Jun-2025 16:56:51,00:00:01,254 KB
422e5a2a7095ceb3188d2d58c0cf69b5,KITEX,Change in Directors/ Key Managerial Personnel/ Auditor/ Compliance Officer/ Share Transfer Agent,23062025165805,https://nsearchives.nseindia.com/corporate/xbrl/CIM_58279_1469726_23062025045805_WEB.xml,Kitex Garments Limited,INE602G01020,2025-06-23 16:58:05,2025-06-23 16:58:05,,Textile Products,,KITEX GARMENTS LIMITED has informed the Exchange about Change in Directors/ Key Managerial Personnel/ Auditor/ Compliance Officer/ Share Transfer Agent,,,,23-Jun-2025 16:58:06,00:00:01,5 KB
073afbc5fd4f326d92783edffe6911a7,FEDERALBNK,General Updates,23062025165906,https://nsearchives.nseindia.com/corporate/FEDERALBNK_23062025165842_ESG_Ratings_Exchange_Intimation_MSCI_230625.pdf,The Federal Bank  Limited,INE171A01011,2025-06-23 16:59:06,2025-06-23 16:59:06,,Banks,,"The Federal Bank  Limited has informed the Exchange about Intimation Under Regulation 30 Of The SEBI (Listing Obligations And Disclosure Requirements) Regulations, 2015 - ESG Rating",,,,23-Jun-2025 16:59:07,00:00:01,238 KB
bce8bed632280cb172745fc512ef4550,NIRAJISPAT,Price movement,23062025165915,-,Niraj Ispat Industries Limited,INE326T01011,2025-06-23 16:59:15,2025-06-23 16:59:15,,,,"Significant movement in price has been observed in Niraj Ispat Industries Limited. The Exchange, in order to ensure that investors have latest relevant information about the company and to inform the market place so that the interest of the investors is safeguarded, has written to the company. The response from the company is awaited.",,,,23-Jun-2025 16:59:15,00:00:00,-
b2eb0a05a32ed76cadb9d5ccb0734a79,GVPTECH,Record Date,23062025170009,https://nsearchives.nseindia.com/corporate/4THDIM_23062025165957_Intimation_Record_date.pdf,GVP Infotech Limited,INE382T01030,2025-06-23 17:00:09,2025-06-23 17:00:09,,,,GVP Infotech Limited has informed the Exchange that Record date for the purpose of Rights  is 30-Jun-2025.,,,,23-Jun-2025 17:00:10,00:00:01,409 KB
587dc6d6475798a751df837ab007d7cd,MANYAVAR,Trading Window,23062025170355,https://nsearchives.nseindia.com/corporate/MANYAVAR_23062025170337_Closure_of_Trading_Window.pdf,Vedant Fashions Limited,INE825V01034,2025-06-23 17:03:55,2025-06-23 17:03:55,,,,"Vedant Fashions Limited has informed the Exchange regarding the Trading Window closure pursuant to SEBI (Prohibition of Insider Trading) Regulations, 2015",,,,23-Jun-2025 17:03:55,00:00:00,701 KB
6b3ef612d758086f5c3cda240f5dc517,DIVGIITTS,Analysts/Institutional Investor Meet/Con. Call Updates,23062025170413,https://nsearchives.nseindia.com/corporate/DIVGITTS_23062025170340_DTTS_IntimationofInvestorMeet_230625_signed.pdf,Divgi Torqtransfer Systems Limited,INE753U01022,2025-06-23 17:04:13,2025-06-23 17:04:13,,,,Divgi Torqtransfer Systems Limited has informed the Exchange about Schedule of meet,,,,23-Jun-2025 17:04:14,00:00:01,2.44 MB
2447273f88b0892ec9257de3a4af2343,NORTHARC,Change in Director(s),23062025170414,https://nsearchives.nseindia.com/corporate/NACL2020_23062025170407_SE_Resgn_TSA_Sd.pdf,Northern Arc Capital Limited,INE850M01015,2025-06-23 17:04:14,2025-06-23 17:04:14,,,,Northern Arc Capital Limited has informed the Exchange regarding Change in Director(s) of the company.,,,,23-Jun-2025 17:04:15,00:00:01,3.64 MB
3ea6b3dc4f40ae4b9f84361abc27698d,XELPMOC,Shareholders meeting,23062025170732,https://nsearchives.nseindia.com/corporate/XELPMOC_23062025170632_EvotingResultandScrutinizerReport_Upload.pdf,Xelpmoc Design And Tech Limited,INE01P501012,2025-06-23 17:07:32,2025-06-23 17:07:32,,,,"Xelpmoc Design And Tech Limited has submitted the Exchange, the voting results in the format prescribed under Regulation 44(3) of the Securities and Exchange Board of India (Listing Obligations and Disclosure Requirements) Regulations, 2015 along with the Scrutiniser''s Report on remote e-voting, for postal ballot notice dated May 19, 2025.",,,,23-Jun-2025 17:07:32,00:00:00,10.46 MB
71e313ec929f3a55cc2bad4e16a0ce2c,JETAIRWAYS,Copy of Newspaper Publication,23062025170853,https://nsearchives.nseindia.com/corporate/JETAIR_23062025170827_Newspaper_Advertisment.pdf,Jet Airways (India) Limited,INE802G01018,2025-06-23 17:08:53,2025-06-23 17:08:53,,Travel And Transport,,Jet Airways (India) Limited has informed the Exchange about Copy of Newspaper Publication,,,,23-Jun-2025 17:08:55,00:00:02,2.81 MB
388152f4c376a55dc288f8d8939e2d01,DOLLAR,Trading Window,23062025170913,https://nsearchives.nseindia.com/corporate/DOLLAR_23062025170855_DIL_Notice_for_closure_of_Trading_Window_Quarter_ended_June_2025.pdf,Dollar Industries Limited,INE325C01027,2025-06-23 17:09:13,2025-06-23 17:09:13,,,,"Dollar Industries Limited has informed the Exchange regarding the Trading Window closure pursuant to SEBI (Prohibition of Insider Trading) Regulations, 2015",,,,23-Jun-2025 17:09:14,00:00:01,528 KB
a606e264f4ae6bcc1e160827f480017f,MANYAVAR,Trading Window-XBRL,23062025171013,https://nsearchives.nseindia.com/corporate/xbrl/CLOSURE_TRADING_WINDOW_1469742_23062025051012_WEB.xml,Vedant Fashions Limited,INE825V01034,2025-06-23 17:10:13,2025-06-23 17:10:13,,,,VEDANT FASHIONS LIMITED has informed the Exchange about Closure of Trading Window,,,,23-Jun-2025 17:10:14,00:00:01,2 KB
f705eab853a547a7bd41057b1aeffdf2,ALIVUS,Shareholders meeting,23062025171117,https://nsearchives.nseindia.com/corporate/GLS_23062025170927_BSE_NSE_Intimation_PB_230625_Signed.pdf,Alivus Life Sciences Limited,INE03Q201024,2025-06-23 17:11:17,2025-06-23 17:11:17,,,,Alivus Life Sciences Limited has informed the Exchange regarding Notice of Postal Ballot,,,,23-Jun-2025 17:11:17,00:00:00,2.96 MB
dc58553474da23b930d3221eb2e691a8,NORTHARC,Change in Directors/ Key Managerial Personnel/ Auditor/ Compliance Officer/ Share Transfer Agent,23062025171244,https://nsearchives.nseindia.com/corporate/xbrl/CIM_58280_1469747_23062025051243_WEB.xml,Northern Arc Capital Limited,INE850M01015,2025-06-23 17:12:44,2025-06-23 17:12:44,,,,NORTHERN ARC CAPITAL LIMITED has informed the Exchange about Change in Directors/ Key Managerial Personnel/ Auditor/ Compliance Officer/ Share Transfer Agent,,,,23-Jun-2025 17:12:45,00:00:01,3 KB
6f3d5c169343e30496e8c12735b8a7d5,EMAMILTD,Disclosure under SEBI Takeover Regulations,23062025171424,https://nsearchives.nseindia.com/corporate/team_bbodade_23062025160518_Emami10.pdf,Emami Limited,INE548C01024,2025-06-23 17:14:24,2025-06-23 17:14:24,,Personal Care,,"Emami Limited has submitted to the Exchange a copy of Disclosures under Regulation 10(6)-Report to stock Exchange in respect of any acquisition made in reliance upon exemption provided for in regulation 10 of SEBI (SAST) Regulations, 2011.",,,,23-Jun-2025 17:14:25,00:00:01,1.69 MB
8ce237ac1019de864ac737052ee1d8b9,NLCINDIA,Trading Window,23062025171428,https://nsearchives.nseindia.com/corporate/NLCINDIA_23062025171342_SEIntimationTradingwindowClosure30June2025__1_.pdf,NLC India Limited,INE589A01014,2025-06-23 17:14:28,2025-06-23 17:14:28,,,,"NLC India Limited has informed the Exchange regarding the Trading Window closure pursuant to SEBI (Prohibition of Insider Trading) Regulations, 2015",,,,23-Jun-2025 17:14:29,00:00:01,2.36 MB
75aa76390d3f29edd5d8ca87174853be,SIMPLEXINF,Shareholders meeting,23062025171725,https://nsearchives.nseindia.com/corporate/SIMPLEXINF_23062025171515_Summary_of_Proceeding_EGM_23062025.pdf,Simplex Infrastructures Limited,INE059B01024,2025-06-23 17:17:25,2025-06-23 17:17:25,,Construction,,"Simplex Infrastructures Limited has informed the Exchange regarding Proceedings of Extraordinary General Meeting held on Jun 23, 2025",,,,23-Jun-2025 17:17:25,00:00:00,752 KB
72a9c60d5e346acf8e0af94e0a3dc6e6,BAFNAPH,Change in Directors/ Key Managerial Personnel/ Auditor/ Compliance Officer/ Share Transfer Agent,23062025171816,https://nsearchives.nseindia.com/corporate/xbrl/CIM_58281_1469749_23062025051815_WEB.xml,Bafna Pharmaceuticals Limited,INE878I01022,2025-06-23 17:18:16,2025-06-23 17:18:16,,,,BAFNA PHARMACEUTICALS LIMITED has informed the Exchange about Change in Directors/ Key Managerial Personnel/ Auditor/ Compliance Officer/ Share Transfer Agent,,,,23-Jun-2025 17:18:17,00:00:01,4 KB
d9378eaf58d464ef98b560b431f07996,CHAMBLFERT,General Updates,23062025171839,https://nsearchives.nseindia.com/corporate/JOYLINJ_23062025171754_Intimation_of_Subsidiary_Dissolution_23062025.pdf,Chambal Fertilizers & Chemicals Limited,INE085A01013,2025-06-23 17:18:39,2025-06-23 17:18:39,,Fertilisers,,Chambal Fertilizers & Chemicals Limited has informed the Exchange about General Updates,,,,23-Jun-2025 17:18:40,00:00:01,232 KB
2e349898324481f454ba58ac5a5fa852,LAXMIDENTL,Analysts/Institutional Investor Meet/Con. Call Updates,23062025171840,https://nsearchives.nseindia.com/corporate/LAXMI_23062025171713_Laxmi_Dental_Stock_Exchange_Intimation_-_Group_Meetings.pdf,Laxmi Dental Limited,INE0WO601020,2025-06-23 17:18:40,2025-06-23 17:18:40,,,,Laxmi Dental Limited has informed the Exchange about Schedule of meet,,,,23-Jun-2025 17:18:41,00:00:01,192 KB
48d5bcbfe8d209f1481b5382f729ac23,JKLAKSHMI,Action(s) taken or orders passed,23062025171903,https://nsearchives.nseindia.com/corporate/JKLASHMI_23062025171617_Disclosure_to_Stock_Exchange_Income_Tax__003_.pdf,JK Lakshmi Cement Limited,INE786A01032,2025-06-23 17:19:03,2025-06-23 17:19:03,,Cement And Cement Products,,"JK Lakshmi Cement Limited has informed the Exchange about disclosure under Regulation 30 of the SEBI (Listing Obligations and Disclosure Requirements) Regulations, 2015.",,,,23-Jun-2025 17:19:05,00:00:02,282 KB
e1064dcf1cbaaafbf7c44c808b065fd9,ALIVUS,Notice Of Shareholders Meetings-XBRL,23062025171934,https://nsearchives.nseindia.com/corporate/xbrl/NOTICE_OF_SHAREHOLDERS_MEETINGS_1469750_23062025051933_WEB.xml,Alivus Life Sciences Limited,INE03Q201024,2025-06-23 17:19:34,2025-06-23 17:19:34,,,,Alivus Life Sciences Limited has informed the Exchange about Notice of Shareholders Meeting for Postal Ballot,,,,23-Jun-2025 17:19:35,00:00:01,7 KB
34f9eed60bd9a684eb2e9c0620de03a4,MUTHOOTCAP,Trading Window,23062025172109,https://nsearchives.nseindia.com/corporate/MUTHOOTCAPS_23062025172040_SE_Intimation_Closure_of_Trading_Window.pdf,Muthoot Capital Services Limited,INE296G01013,2025-06-23 17:21:09,2025-06-23 17:21:09,,,,"Muthoot Capital Services Limited has informed the Exchange regarding the Trading Window closure pursuant to SEBI (Prohibition of Insider Trading) Regulations, 2015",,,,23-Jun-2025 17:21:10,00:00:01,2.69 MB
