hash,symbol,desc,dt,attchmntFile,sm_name,sm_isin,an_dt,sort_date,seq_id,smIndustry,orgid,attchmntText,bflag,old_new,csvName,exchdisstime,difference,fileSize
1a180e2e28b79498be537932265b909b,SAGILITY,General Updates,23062025211355,https://nsearchives.nseindia.com/corporate/SAGILITY_23062025211342_IntimationNCDRedemption23062025signed.pdf,Sagility India Limited,INE0W2G01015,2025-06-23 21:13:55,2025-06-23 21:13:55,,,,"Sagility India Limited has informed the Exchange about Intimation under Regulation 30 of the Securities and Exchange Board of India (Listing Obligations and Disclosure Requirements) Regulations, 2015 - Partial Redemption of Unsecured, Unlisted Redeemable Non-Convertible Debentures",,,,23-Jun-2025 21:13:56,00:00:01,259 KB
8776293d4cb59d82e93de6b9b72a751d,EIEL,General Updates,23062025211513,https://nsearchives.nseindia.com/corporate/ENVIRO_23062025211440_Press_release_solar.pdf,Enviro Infra Engineers Limited,INE0LLY01014,2025-06-23 21:15:13,2025-06-23 21:15:13,,,,Enviro Infra Engineers Limited has informed the Exchange about General Updates,,,,23-Jun-2025 21:15:14,00:00:01,392 KB
94ab9c8d78df57be4aeecc5bcb1389b7,SKFINDIA,Trading Window,23062025211742,https://nsearchives.nseindia.com/corporate/SKFINDIA22_23062025211646_NSE.pdf,SKF India Limited,INE640A01023,2025-06-23 21:17:42,2025-06-23 21:17:42,,Bearings,,"SKF India Limited has informed the Exchange regarding the Trading Window closure pursuant to SEBI (Prohibition of Insider Trading) Regulations, 2015",,,,23-Jun-2025 21:17:43,00:00:01,272 KB
8bcb0ae81b2019b089373955342323e2,EIEL,Awarding of order(s)/contract(s),23062025212504,https://nsearchives.nseindia.com/corporate/ENVIRO_23062025212450_Press_release.pdf,Enviro Infra Engineers Limited,INE0LLY01014,2025-06-23 21:25:04,2025-06-23 21:25:04,,,,Enviro Infra Engineers Limited has informed the Exchange about Awarding of order(s)/contract(s),,,,23-Jun-2025 21:25:05,00:00:01,460 KB
82a069372e812b8112dcef0472c451ce,SKFINDIA,Trading Window-XBRL,23062025212827,https://nsearchives.nseindia.com/corporate/xbrl/CLOSURE_TRADING_WINDOW_1469998_23062025092826_WEB.xml,SKF India Limited,INE640A01023,2025-06-23 21:28:27,2025-06-23 21:28:27,,Bearings,,SKF INDIA LIMITED has informed the Exchange about Closure of Trading Window,,,,23-Jun-2025 21:28:29,00:00:02,2 KB
349ec6edf0c74f2e0e1782513649e8bd,TIRUMALCHM,Copy of Newspaper Publication,23062025213109,https://nsearchives.nseindia.com/corporate/TIRUMALCHM1_23062025213045_Intimation_EGM_notice_advertisement__1_.pdf,Thirumalai Chemicals Limited,INE338A01016,2025-06-23 21:31:09,2025-06-23 21:31:09,,Chemicals - Organic,,Thirumalai Chemicals Limited has informed the Exchange about Copy of Newspaper Publication,,,,23-Jun-2025 21:31:10,00:00:01,5.00 MB
af62140689f8c0721478a86660dda027,EIEL,Acquisition-XBRL,23062025213236,https://nsearchives.nseindia.com/corporate/xbrl/REG30_Restructuring_1469999_23062025093236_WEB.xml,Enviro Infra Engineers Limited,INE0LLY01014,2025-06-23 21:32:36,2025-06-23 21:32:36,,,,Enviro Infra Engineers Limited has informed the Exchange regarding Acquisition,,,,23-Jun-2025 21:32:37,00:00:01,7 KB
5c7135e852cb409a3e2242b7e8dc92ea,RCOM,General Updates,23062025213821,https://nsearchives.nseindia.com/corporate/RCOM_23062025213807_RCOMDISCLOSURE23062025.pdf,Reliance Communications Limited,INE330H01018,2025-06-23 21:38:21,2025-06-23 21:38:21,,Telecommunication - Services,,Reliance Communications Limited has informed the Exchange about General Updates Disclosure under Regulation 30 of SEBI (Listing Obligations and Disclosure Requirements) Regulation 2015.,,,,23-Jun-2025 21:38:22,00:00:01,1.04 MB
26781bd8f71ce96a33393267aaa7a143,ALKEM,General Updates,23062025214121,https://nsearchives.nseindia.com/corporate/ALKEM_23062025213913_Regulation30CompletionofSaleofIndorePlantJune2025_signed.pdf,Alkem Laboratories Limited,INE540L01014,2025-06-23 21:41:21,2025-06-23 21:41:21,,,,"Alkem Laboratories Limited has informed the Exchange that today i.e. on 23rd June, 2025, the sale and transfer of the Company s manufacturing facility in Madhya Pradesh stands completed in accordance with the conditions prescribed in the Business Transfer Agreement dated 06th January, 2025.",,,,23-Jun-2025 21:41:22,00:00:01,299 KB
26b351bb69eae4fc68e0d9ba06c24b33,PGHH,Appointment,23062025214719,https://nsearchives.nseindia.com/corporate/PGHH_23062025214700_PGHHSMPchange_June_2025.pdf,Procter & Gamble Hygiene and Health Care Limited,INE179A01014,2025-06-23 21:47:19,2025-06-23 21:47:19,,Personal Care,,"Procter & Gamble Hygiene and Health Care Limited has informed the Exchange regarding Appointment of  Jai Pankaj as Company s Head of Information Technology effective September 1, 2025.",,,,23-Jun-2025 21:47:21,00:00:02,441 KB
8ea9e96a6c93469251839fd5ab8aeaa6,PGHH,Cessation,23062025214719,https://nsearchives.nseindia.com/corporate/PGHH_23062025214652_PGHHSMPchange_June_2025.pdf,Procter & Gamble Hygiene and Health Care Limited,INE179A01014,2025-06-23 21:47:19,2025-06-23 21:47:19,,Personal Care,,"Procter & Gamble Hygiene and Health Care Limited has informed the Exchange that Mr. Nikunj Jain, shall cease to be Company s head of Information Technology effective close of business hours of June 30, 2025, due to a change in his assignment at P&G. Letter of cessation received from Mr. Nikunj Jain is enclosed.",,,,23-Jun-2025 21:47:21,00:00:02,441 KB
2623bf45c30ad5e223815fdcb5520078,PGHH,Change in Directors/ Key Managerial Personnel/ Auditor/ Compliance Officer/ Share Transfer Agent,23062025214748,https://nsearchives.nseindia.com/corporate/xbrl/CIM_58312_1470002_23062025094747_WEB.xml,Procter & Gamble Hygiene and Health Care Limited,INE179A01014,2025-06-23 21:47:48,2025-06-23 21:47:48,,Personal Care,,PROCTER & GAMBLE HYGIENE AND HEALTH CARE LIMITED has informed the Exchange about Change in Directors/ Key Managerial Personnel/ Auditor/ Compliance Officer/ Share Transfer Agent,,,,23-Jun-2025 21:47:49,00:00:01,10 KB
a38e20577dd973efbcb1ece1be0ffda6,SIGNATURE,Updates,23062025214816,https://nsearchives.nseindia.com/corporate/SGLOBAL_23062025214424_LETTER23062025signed.pdf,Signatureglobal (India) Limited,INE903U01023,2025-06-23 21:48:16,2025-06-23 21:48:16,,,,"Signatureglobal (India) Limited has informed the Exchange regarding 'Pursuant to Regulation 30 of SEBI (Listing Obligations and Disclosure Requirements) Regulations, 2015, we wish to inform you that Signatureglobal Business Park Private Limited, a wholly owned subsidiary of the Company, has executed two Sale Deeds today i.e. on 23rd June, 2025 to purchase the lands admeasuring approximately 9.96 Acres situated at Tehsil Sohna, District Gurugram, Haryana. The said lands have jointly an overall potential sales area of approximately 0.53 million square feet.     '.",,,,23-Jun-2025 21:48:17,00:00:01,798 KB
b7ed07e4a770a9c71b763b8ec1c994f4,GILLETTE,Appointment,23062025215531,https://nsearchives.nseindia.com/corporate/GILLETTE_23062025215457_GILChangeinSMPNikunjJai.pdf,Gillette India Limited,INE322A01010,2025-06-23 21:55:31,2025-06-23 21:55:31,,Personal Care,,"Gillette India Limited has informed the Exchange regarding Appointment of Mr Jai Pankaj as Other of the company w.e.f. September 01, 2025.",,,,23-Jun-2025 21:55:31,00:00:00,404 KB
67bc633d738bf26303eb3b36d33920a2,GILLETTE,Cessation,23062025215531,https://nsearchives.nseindia.com/corporate/GILLETTE_23062025215446_GILChangeinSMPNikunjJai.pdf,Gillette India Limited,INE322A01010,2025-06-23 21:55:31,2025-06-23 21:55:31,,Personal Care,,"Gillette India Limited has informed the Exchange regarding Cessation of Mr Nikunj Jain as Other of the company w.e.f. Jun 30, 2025.",,,,23-Jun-2025 21:55:31,00:00:00,404 KB
a982ae9165424a8331f557175647898b,GILLETTE,Change in Directors/ Key Managerial Personnel/ Auditor/ Compliance Officer/ Share Transfer Agent,23062025215844,https://nsearchives.nseindia.com/corporate/xbrl/CIM_58313_1470005_23062025095843_WEB.xml,Gillette India Limited,INE322A01010,2025-06-23 21:58:44,2025-06-23 21:58:44,,Personal Care,,GILLETTE INDIA LIMITED has informed the Exchange about Change in Directors/ Key Managerial Personnel/ Auditor/ Compliance Officer/ Share Transfer Agent,,,,23-Jun-2025 21:58:45,00:00:01,5 KB
0994053b6117d471e209098d15889106,SRPL,Clarification - Financial Results,23062025220041,-,Shree Ram Proteins Limited,INE008Z01012,2025-06-23 22:00:41,2025-06-23 22:00:41,,,,"The Exchange has sought clarification from Shree Ram Proteins Limited for the quarter ended 31-Mar-2025 with respect to Regulation 33 of the SEBI (Listing Obligations and Disclosure Requirements) Regulations, 2015. On basis of above the Company is required to clarify the following:  -1. Limited Review Report/ Independent Auditor's Report is not in the format prescribed by SEBI -2. The company has not submitted the Statement of Impact of Audit Qualifications in case of modified opinion(s) The response of the Company is awaited.",,,,23-Jun-2025 22:00:42,00:00:01,-
f726923be9e260d22a6bc868dc93c7e0,PREMIERENE,Credit Rating,23062025220442,https://nsearchives.nseindia.com/corporate/PEL2024_23062025220352_PELCREDITRATINGcf.pdf,Premier Energies Limited,INE0BS701011,2025-06-23 22:04:42,2025-06-23 22:04:42,,,,Premier Energies Limited has informed the Exchange about Credit Rating,,,,23-Jun-2025 22:04:43,00:00:01,7.29 MB
9854fee8914b35d6c5240f28c75bf5cd,MARATHON,Committee Meeting Updates,23062025220642,https://nsearchives.nseindia.com/corporate/MARATHON_23062025220633_Outcome.pdf,Marathon Nextgen Realty Limited,INE182D01012,2025-06-23 22:06:42,2025-06-23 22:06:42,,,,"Marathon Nextgen Realty Limited has informed the Exchange regarding Outcome of Committee Meeting held on Jun 23, 2025.",,,,23-Jun-2025 22:06:43,00:00:01,596 KB
c068cc24aeeca497f3b835a97bbfddad,ONESOURCE,Change in Directors/ Key Managerial Personnel/ Auditor/ Compliance Officer/ Share Transfer Agent,23062025220931,https://nsearchives.nseindia.com/corporate/xbrl/CIM_58318_1470013_23062025100930_WEB.xml,Onesource Specialty Pharma Limited,INE013P01021,2025-06-23 22:09:31,2025-06-23 22:09:31,,,,ONESOURCE SPECIALTY PHARMA LIMITED has informed the Exchange about Change in Directors/ Key Managerial Personnel/ Auditor/ Compliance Officer/ Share Transfer Agent,,,,23-Jun-2025 22:09:32,00:00:01,5 KB
85a14d31e70917300ccf10b800404db0,ONESOURCE,Change in Director(s),23062025221512,https://nsearchives.nseindia.com/corporate/ONESOURCECDMO_23062025221357_OneSource_Intimation_for_appointment_of_Director.pdf,Onesource Specialty Pharma Limited,INE013P01021,2025-06-23 22:15:12,2025-06-23 22:15:12,,,,Onesource Specialty Pharma Limited has informed the Exchange regarding Change in Director(s) of the company.,,,,23-Jun-2025 22:15:13,00:00:01,618 KB
99f9605688e08b0c6dd98f104bbc2f26,THOMASCOOK,Credit Rating,23062025222435,https://nsearchives.nseindia.com/corporate/THOMASCOOK_23062025222148_Reg30upgradationofcreditratingintimation.pdf,Thomas Cook  (India)  Limited,INE332A01027,2025-06-23 22:24:35,2025-06-23 22:24:35,,Travel And Transport,,Thomas Cook  (India)  Limited has informed the Exchange about Credit Rating,,,,23-Jun-2025 22:24:36,00:00:01,936 KB
9df6d742f6b11354c3fb6023e7edaa50,TECHM,Shareholders meeting,23062025222633,https://nsearchives.nseindia.com/corporate/Apekshakhemka_23062025222627_StockExchangeIntimationAGM_S.pdf,Tech Mahindra Limited,INE669C01028,2025-06-23 22:26:33,2025-06-23 22:26:33,,Computers - Software,,"The 38th Annual General Meeting Of The Company Will Be Held On Thursday, 17th July, 2025 at 3.30 P.M. (IST) through Video Conferencing / Other Audio Visual Means.",,,,23-Jun-2025 22:26:33,00:00:00,11.22 MB
d7acbdcc486cbae59c0b98dbfb689985,BLUSPRING,Outcome of Board Meeting,23062025223053,https://nsearchives.nseindia.com/corporate/BLUSPRING_23062025222557_Outcome.pdf,Bluspring Enterprises Limited,INE0U4101014,2025-06-23 22:30:53,2025-06-23 22:30:53,,,,"Bluspring Enterprises Limited has informed the Exchange regarding Outcome of Board meeting held on Jun 23, 2025 for the financial results for the quarter and financial year ended March 31, 2025.",,,,23-Jun-2025 22:30:54,00:00:01,4.14 MB
01dbeb3f813bd397a606220294cafc6f,ACLGATI,Analysts/Institutional Investor Meet/Con. Call Updates,23062025224337,https://nsearchives.nseindia.com/corporate/GATI_23062025224329_SignedAGL-Meeting_cancellation.pdf,Allcargo Gati Limited,INE152B01027,2025-06-23 22:43:37,2025-06-23 22:43:37,,,,Allcargo Gati Limited has informed the Exchange about Cancellation Of Analyst/Institutional Investor Meeting,,,,23-Jun-2025 22:43:38,00:00:01,323 KB
7bc2ef3ba989dc22d2267139098433a6,ZENTEC,ESOP/ESOS/ESPS,23062025224410,https://nsearchives.nseindia.com/corporate/ZENTEC_23062025224404_23_06_2025_1060.pdf,Zen Technologies Limited,INE251B01027,2025-06-23 22:44:10,2025-06-23 22:44:10,,,,Zen Technologies Limited has informed the Exchange regarding Exercise of 1060  Options.,,,,23-Jun-2025 22:44:10,00:00:00,593 KB
ce350e9d3e6c3bfcf2a2add68d2d67de,RALLIS,Shareholders meeting,23062025225151,https://nsearchives.nseindia.com/corporate/RALLIS1_23062025225116_AGMOUTCOME23062025SIGNED.pdf,Rallis India Limited,INE613A01012,2025-06-23 22:51:51,2025-06-23 22:51:51,,Pesticides And Agrochemicals,,"Rallis India Limited has informed the Exchange regarding Proceedings of Annual General Meeting held on Jun 23, 2025. Further, the company has submitted the Exchange a copy of Srutinizers report along with voting results.",,,,23-Jun-2025 22:51:51,00:00:00,2.60 MB
9c5bc9709db596288771378f0a55a493,BLUSPRING,Outcome of Board Meeting,23062025225517,https://nsearchives.nseindia.com/corporate/BLUSPRING_23062025225335_Outcome.pdf,Bluspring Enterprises Limited,INE0U4101014,2025-06-23 22:55:17,2025-06-23 22:55:17,,,,"Bluspring Enterprises Limited has submitted to the Exchange, the financial results for the period ended March 31, 2025.",,,,23-Jun-2025 22:55:18,00:00:01,4.14 MB
8841432252dc249735f6a0f66dff6cbc,BLUSPRING,Press Release,23062025230632,https://nsearchives.nseindia.com/corporate/BLUSPRING_23062025230623_PR.pdf,Bluspring Enterprises Limited,INE0U4101014,2025-06-23 23:06:32,2025-06-23 23:06:32,,,,"Bluspring Enterprises Limited has informed the Exchange regarding a press release dated Jun 23, 2025, titled ""Bluspring announced financial results as an independent listed entity FY25# Revenue at &#8377;2,969 crore with EBITDA at 110 crore"".",,,,23-Jun-2025 23:06:34,00:00:02,860 KB
ba5ec55cdd74aff9f9c5f8f9c43c4cf3,TECHM,Notice Of Shareholders Meetings-XBRL,23062025230924,https://nsearchives.nseindia.com/corporate/xbrl/NOTICE_OF_SHAREHOLDERS_MEETINGS_1470016_23062025110923_WEB.xml,Tech Mahindra Limited,INE669C01028,2025-06-23 23:09:24,2025-06-23 23:09:24,,Computers - Software,,Tech Mahindra Limited has informed the Exchange about Notice of Shareholders Meeting for Annual General Meeting to be held on 17-Jul-2025,,,,23-Jun-2025 23:09:25,00:00:01,16 KB
12bbb8decca92d98dd726e7ca17f850b,BLUSPRING,General Updates,23062025230955,https://nsearchives.nseindia.com/corporate/BLUSPRING_23062025230943_EP.pdf,Bluspring Enterprises Limited,INE0U4101014,2025-06-23 23:09:55,2025-06-23 23:09:55,,,,"Bluspring Enterprises Limited has informed the Exchange about General Updates regarding Earnings Presentation of the Company for the quarter and financial year ended March 31, 2025",,,,23-Jun-2025 23:09:56,00:00:01,3.46 MB
0977ec0f4c257164f6e0033d7af83ae6,HOMEFIRST,Analysts/Institutional Investor Meet/Con. Call Updates,23062025231522,https://nsearchives.nseindia.com/corporate/HOMEFIRST_23062025231505_Investor_Meet_Intimation_-_23062025.pdf,Home First Finance Company India Limited,INE481N01025,2025-06-23 23:15:22,2025-06-23 23:15:22,,,,Home First Finance Company India Limited has informed the Exchange about Schedule of meet,,,,23-Jun-2025 23:15:22,00:00:00,270 KB
ba02e841b31bb6e35af34fbbc626ad6a,PERSISTENT,Shareholders meeting,23062025231526,https://nsearchives.nseindia.com/corporate/PERSISTENTUSER1_23062025231514_PersistentSystemsLimitedNoticeof35thAGM202425signed.pdf,Persistent Systems Limited,INE262H01013,2025-06-23 23:15:26,2025-06-23 23:15:26,,Computers - Software,,"Persistent Systems Limited has informed the Exchange regarding Notice of Annual General Meeting to be held on July 21, 2025",,,,23-Jun-2025 23:15:26,00:00:00,721 KB
9760224c7cd68bf2e3a04ac294901140,M&M,Investor Presentation,23062025232053,https://nsearchives.nseindia.com/corporate/Shaibya_23062025232030_Concluded23062025.pdf,Mahindra & Mahindra Limited,INE101A01026,2025-06-23 23:20:53,2025-06-23 23:20:53,,Automobiles - 4 Wheelers,,Mahindra & Mahindra Limited has informed the Exchange about Investor Presentation,,,,23-Jun-2025 23:20:54,00:00:01,216 KB
69450c289f845ad59cb46403fb34d671,KSHITIJPOL,Shareholders meeting,23062025232103,https://nsearchives.nseindia.com/corporate/KSHITIJPOL_23062025232025_PB_Intimation.pdf,Kshitij Polyline Limited,IN0000000000,2025-06-23 23:21:03,2025-06-23 23:21:03,,,,Kshitij Polyline Limited has informed the Exchange about Shareholders meeting,,,,23-Jun-2025 23:21:04,00:00:01,973 KB
fce360029ae182c384c288d9750feb0a,KSHITIJPOL,Notice Of Shareholders Meetings-XBRL,23062025232305,https://nsearchives.nseindia.com/corporate/xbrl/NOTICE_OF_SHAREHOLDERS_MEETINGS_1470023_23062025112304_WEB.xml,Kshitij Polyline Limited,IN0000000000,2025-06-23 23:23:05,2025-06-23 23:23:05,,,,Kshitij Polyline Limited has informed the Exchange about Notice of Shareholders Meeting for Postal Ballot,,,,23-Jun-2025 23:23:06,00:00:01,6 KB
d6239e65fa2ac7a9dd3fe733ac083738,ORIENTCEM,General Updates,23062025232646,https://nsearchives.nseindia.com/corporate/ORIENTCEM_23062025232619_SECoveringCommToShareholdersIEPF2025.pdf,Orient Cement Limited,INE876N01018,2025-06-23 23:26:46,2025-06-23 23:26:46,,,,Orient Cement Limited has informed the Exchange about the Notice sent to the Shareholders.,,,,23-Jun-2025 23:26:47,00:00:01,176 KB
aaef681aab4c7154935758aa77876074,TECHM,General Updates,23062025232916,https://nsearchives.nseindia.com/corporate/Apekshakhemka_23062025232906_SEIntimationNonregistredemail_S.pdf,Tech Mahindra Limited,INE669C01028,2025-06-23 23:29:16,2025-06-23 23:29:16,,Computers - Software,,"Letter to shareholders- Intimation under Regulation 30 of the SEBI (Listing Obligations and Disclosure Requirements) Regulations, 2015 ( SEBI Listing Regulations )",,,,23-Jun-2025 23:29:17,00:00:01,353 KB
d40ad4cb8ff84093d99e0e7a7cc6d2a5,ICICIGI,ESOP/ESOS/ESPS,23062025233044,https://nsearchives.nseindia.com/corporate/ICICIGI_23062025232752_ESOSIntimationJuneIII.pdf,ICICI Lombard General Insurance Company Limited,INE765G01017,2025-06-23 23:30:44,2025-06-23 23:30:44,,,,ICICI Lombard General Insurance Company Limited has informed the Exchange regarding Allotment of 147639  Shares.,,,,23-Jun-2025 23:30:45,00:00:01,2.58 MB
e09ebaaed147fa6c0ec4bc8b1918760e,TECHM,General Updates,23062025233422,https://nsearchives.nseindia.com/corporate/Apekshakhemka_23062025233414_StockExchangeIntimationBRSR_S.pdf,Tech Mahindra Limited,INE669C01028,2025-06-23 23:34:22,2025-06-23 23:34:22,,Computers - Software,,"Business Responsibility and Sustainability Report for the financial year 2024-25 - Regulation 34(2)(f) of the Securities and Exchange Board of India (Listing Obligations and Disclosure Requirements) Regulations, 2015 (""SEBI Listing Regulations"").",,,,23-Jun-2025 23:34:24,00:00:02,1.44 MB
ffbb299d022c6f9eeecdbb80cd98f3bf,PERSISTENT,Record Date,23062025235006,https://nsearchives.nseindia.com/corporate/PERSISTENTUSER1_23062025234932_PSLBookClosureIntimationsigned.pdf,Persistent Systems Limited,INE262H01013,2025-06-23 23:50:06,2025-06-23 23:50:06,,Computers - Software,,Persistent Systems Limited has informed the Exchange that Record date for the purpose of Dividend  is 14-Jul-2025.,,,,23-Jun-2025 23:50:07,00:00:01,199 KB
2ef42c785e0c63a5e4c6e5087441c79f,PERSISTENT,Updates,23062025235303,https://nsearchives.nseindia.com/corporate/PERSISTENTUSER1_23062025235235_PSLBusinessResponsibilityandSustainabilityReport2025signed.pdf,Persistent Systems Limited,INE262H01013,2025-06-23 23:53:03,2025-06-23 23:53:03,,Computers - Software,,Persistent Systems Limited has informed the Exchange regarding 'Submission of Business Responsibility and Sustainability Report for FY 2024-25'.,,,,23-Jun-2025 23:53:04,00:00:01,3.12 MB
dd986e1c4cf7c1afcb7b10f43653108c,HDFCLIFE,General Updates,24062025000009,https://nsearchives.nseindia.com/corporate/PRASAD_24062025000000_BRSRsigned.pdf,HDFC Life Insurance Company Limited,INE795G01014,2025-06-24 00:00:09,2025-06-24 00:00:09,,,,HDFC Life Insurance Company Limited has informed the Exchange about Business Responsibility and Sustainability Report,,,,24-Jun-2025 00:00:10,00:00:01,497 KB
b7a09dd9907ea76baf1a4ff1d8b7b652,PERSISTENT,Analysts/Institutional Investor Meet/Con. Call Updates,24062025001108,https://nsearchives.nseindia.com/corporate/PERSISTENTUSER1_24062025001058_PSLOutcomeofsessionJune232025_signed.pdf,Persistent Systems Limited,INE262H01013,2025-06-24 00:11:08,2025-06-24 00:11:08,,Computers - Software,,Persistent Systems Limited has informed the Exchange about Presentation,,,,24-Jun-2025 00:11:09,00:00:01,114 KB
33e9904c869536f81aff521f55eae840,KRN,Analysts/Institutional Investor Meet/Con. Call Updates,24062025001738,https://nsearchives.nseindia.com/corporate/KRNHEAT_24062025001726_outcomecallsigned.pdf,KRN Heat Exchanger and Refrigeration Limited,INE0Q3J01015,2025-06-24 00:17:38,2025-06-24 00:17:38,,,,"KRN Heat Exchanger and Refrigeration Limited has informed the Exchange about Outcome of Analysts/investors Meets held on June 23, 2025",,,,24-Jun-2025 00:17:38,00:00:00,691 KB
19e4789d234948ce6ed5e993a2eb319f,PERSISTENT,Trading Window,24062025002014,https://nsearchives.nseindia.com/corporate/PERSISTENTUSER1_24062025001958_PersistentSystemsBMIntimationJune242025signed.pdf,Persistent Systems Limited,INE262H01013,2025-06-24 00:20:14,2025-06-24 00:20:14,,Computers - Software,,"Persistent Systems Limited has informed the Exchange regarding the Trading Window closure pursuant to SEBI (Prohibition of Insider Trading) Regulations, 2015",,,,24-Jun-2025 00:20:15,00:00:01,166 KB
3aa706e3e41d18b689f9c7d9c6c26e0a,ICICIGI,Alteration Of Capital and Fund Raising-XBRL,24062025002539,https://nsearchives.nseindia.com/corporate/xbrl/ALTERATION_OF_CAPITAL_AND_FUND_RAISING_1470027_24062025122538_WEB.xml,ICICI Lombard General Insurance Company Limited,INE765G01017,2025-06-24 00:25:39,2025-06-24 00:25:39,,,,ICICI Lombard General Insurance Company Limited has informed the Exchange regarding Allotment of Securities,,,,24-Jun-2025 00:25:40,00:00:01,6 KB
3ce987bb84f4e44414542172f5c3bbcb,ACMESOLAR,Commencement of commercial production/operations,24062025083220,https://nsearchives.nseindia.com/corporate/ACME122002_24062025083156_Intimation.pdf,Acme Solar Holdings Limited,INE622W01025,2025-06-24 08:32:20,2025-06-24 08:32:20,,,,Acme Solar Holdings Limited has informed the Exchange about Commencement of commercial production/operations,,,,24-Jun-2025 08:32:21,00:00:01,259 KB
0b6eaaa7fae176c35c4958eaf204132f,BIOCON,Press Release,24062025085544,https://nsearchives.nseindia.com/corporate/Biocon2_24062025085406_SEPressrelase-24062025.pdf,Biocon Limited,INE376G01013,2025-06-24 08:55:44,2025-06-24 08:55:44,,Pharmaceuticals,,"Biocon Limited has informed the Exchange regarding a press release dated Jun 24, 2025, titled ""Biocon Biologics Collaborates with National Cancer Society MalaysiaRolls Out Patient Assistance Program to Expand Affordable Access to Biosimilars"".",,,,24-Jun-2025 08:55:45,00:00:01,399 KB
00156f3152c8667a637ecb4f43be5de6,LMW,Trading Window,24062025092106,https://nsearchives.nseindia.com/corporate/LAXMIMACH_24062025092020_FILINGTRADINGWINDOW.pdf,LMW Limited,INE269B01029,2025-06-24 09:21:06,2025-06-24 09:21:06,,,,"LMW Limited has informed the Exchange regarding the Trading Window closure pursuant to SEBI (Prohibition of Insider Trading) Regulations, 2015",,,,24-Jun-2025 09:21:07,00:00:01,970 KB
d10d1a5e9509e57984bb925f243a9a16,LMW,Trading Window-XBRL,24062025092222,https://nsearchives.nseindia.com/corporate/xbrl/CLOSURE_TRADING_WINDOW_1470028_24062025092221_WEB.xml,LMW Limited,INE269B01029,2025-06-24 09:22:22,2025-06-24 09:22:22,,,,LMW LIMITED has informed the Exchange about Closure of Trading Window,,,,24-Jun-2025 09:22:23,00:00:01,2 KB
44656d86e58c619f8af0c3db16b96eda,360ONE,Action(s) initiated or orders passed,24062025092546,https://nsearchives.nseindia.com/corporate/IIFLWAM_24062025092354_20250624LevyofPenaltybyMCXCCL.pdf,360 ONE WAM LIMITED,INE466L01020,2025-06-24 09:25:46,2025-06-24 09:25:46,,,,"360 ONE WAM LIMITED has intimated the Exchange on a disclosure under Regulation 30 of the SEBI (Listing Obligations and Disclosure Requirements) Regulations, 2015",,,,24-Jun-2025 09:25:47,00:00:01,2.61 MB
6436671b2baf76b7e5a1cf30fd37bc3e,IPCALAB,Trading Window,24062025093220,https://nsearchives.nseindia.com/corporate/IPCALAB_24062025093209_IpcaClosureofTradingWindow.pdf,IPCA Laboratories Limited,INE571A01020,2025-06-24 09:32:20,2025-06-24 09:32:20,,Pharmaceuticals,,"IPCA Laboratories Limited has informed the Exchange regarding the Trading Window closure pursuant to SEBI (Prohibition of Insider Trading) Regulations, 2015",,,,24-Jun-2025 09:32:21,00:00:01,120 KB
5b211afb91950f673f4d7b8fb846c5c2,IPCALAB,Trading Window-XBRL,24062025093336,https://nsearchives.nseindia.com/corporate/xbrl/CLOSURE_TRADING_WINDOW_1470031_24062025093336_WEB.xml,IPCA Laboratories Limited,INE571A01020,2025-06-24 09:33:36,2025-06-24 09:33:36,,Pharmaceuticals,,IPCA LABORATORIES LIMITED has informed the Exchange about Closure of Trading Window,,,,24-Jun-2025 09:33:37,00:00:01,2 KB
716cc2a3aded6584efd0c78f0c20cfb1,CAPTRUST,General Updates,24062025093912,https://nsearchives.nseindia.com/corporate/CAPTRUST_24062025093737_sale_of_shares_intimation.pdf,Capital Trust Limited,INE707C01018,2025-06-24 09:39:12,2025-06-24 09:39:12,,,,"Capital Trust Limited has informed the Exchange about General Updates on Intimation under Regulation 30 of SEBI (LODR) Regulations, 2015   Sale of Equity Shares by Promoter",,,,24-Jun-2025 09:39:13,00:00:01,1.75 MB
