hash,symbol,desc,dt,attchmntFile,sm_name,sm_isin,an_dt,sort_date,seq_id,smIndustry,orgid,attchmntText,bflag,old_new,csvName,exchdisstime,difference,fileSize
63c60d3a120f3c815fddbdcfd9e86c26,MUTHOOTFIN,Alteration Of Capital and Fund Raising-XBRL,24062025163201,https://nsearchives.nseindia.com/corporate/xbrl/ALTERATION_OF_CAPITAL_AND_FUND_RAISING_1470328_24062025043200_WEB.xml,Muthoot Finance Limited,INE414G01012,2025-06-24 16:32:01,2025-06-24 16:32:01,,Finance,,MUTHOOT FINANCE LIMITED has informed the Exchange regarding Allotment of Securities,,,,24-Jun-2025 16:32:02,00:00:01,4 KB
a997f4ff1659c97b293cea51514db10c,21STCENMGM,Trading Window,24062025163214,https://nsearchives.nseindia.com/corporate/21STCENMGM_24062025163202_21STCENMGMTWCLOSUREJUNE2025.pdf,21st Century Management Services Limited,INE253B01015,2025-06-24 16:32:14,2025-06-24 16:32:14,,Finance,,"21st Century Management Services Limited has informed the Exchange regarding the Trading Window closure pursuant to SEBI (Prohibition of Insider Trading) Regulations, 2015",,,,24-Jun-2025 16:32:15,00:00:01,289 KB
c2b41e8fe4bef2a0f6eee34d856574e6,SUZLON,Trading Window-XBRL,24062025163233,https://nsearchives.nseindia.com/corporate/xbrl/CLOSURE_TRADING_WINDOW_1470329_24062025043232_WEB.xml,Suzlon Energy Limited,INE040H01021,2025-06-24 16:32:33,2025-06-24 16:32:33,,Electrical Equipment,,Suzlon Energy Limited has informed the Exchange about Closure of Trading Window,,,,24-Jun-2025 16:32:33,00:00:00,2 KB
6abc04e29ac1bd1ba887d589e8b7a479,BLUEDART,Analysts/Institutional Investor Meet/Con. Call Updates,24062025163318,https://nsearchives.nseindia.com/corporate/BLUEDART_24062025163251_ICALL3006.pdf,Blue Dart Express Limited,INE233B01017,2025-06-24 16:33:18,2025-06-24 16:33:18,,Travel And Transport,,Blue Dart Express Limited has informed the Exchange about Schedule of meet,,,,24-Jun-2025 16:33:18,00:00:00,2.63 MB
a1afb57ab75af61e01bd48085198e63b,CSLFINANCE,Resignation,24062025163327,https://nsearchives.nseindia.com/corporate/CSLFINANCELIMITED_24062025163231_Initmation_of_Resignation.pdf,CSL Finance Limited,INE718F01018,2025-06-24 16:33:27,2025-06-24 16:33:27,,,,"CSL Finance Limited has informed the Exchange regarding Resignation of Mr Atul Kumar  as Other of the company w.e.f. Jun 23, 2025.",,,,24-Jun-2025 16:33:28,00:00:01,411 KB
1e160c99df116c3892be81f01f428542,ZFCVINDIA,Shareholders meeting,24062025163328,https://nsearchives.nseindia.com/corporate/WABCOINDIA_24062025163151_SdSdSE-Proceedings_Postal_Ballot.pdf,ZF Commercial Vehicle Control Systems India Limited,INE342J01019,2025-06-24 16:33:28,2025-06-24 16:33:28,,,,ZF Commercial Vehicle Control Systems India Limited has informed the Exchange regarding Proceedings of Postal Ballot,,,,24-Jun-2025 16:33:28,00:00:00,353 KB
d8f1178d4fdd3576d767d71886067fa5,SHOPERSTOP,Copy of Newspaper Publication,24062025163342,https://nsearchives.nseindia.com/corporate/SHOPERSTOP_24062025162700_Disclosure_NewspaperAdvt240625signed.pdf,Shoppers Stop Limited,INE498B01016,2025-06-24 16:33:42,2025-06-24 16:33:42,,Miscellaneous,,Shoppers Stop Limited has informed the Exchange about Copy of Newspaper Publication,,,,24-Jun-2025 16:33:43,00:00:01,7.11 MB
f04f0fd3b51e43965cdc349fcd2e93a3,SHOPERSTOP,Updates,24062025163342,https://nsearchives.nseindia.com/corporate/SHOPERSTOP_24062025163248_Reg36Disclosuresigned240625.pdf,Shoppers Stop Limited,INE498B01016,2025-06-24 16:33:42,2025-06-24 16:33:42,,Miscellaneous,,"Shoppers Stop Limited has informed the Exchange regarding 'Intimation under Regulation 30 of Securities and Exchange Board of India (Listing Obligations and DisclosureRequirements) Regulations, 2015 ( SEBI Listing Regulations )'.",,,,24-Jun-2025 16:33:43,00:00:01,808 KB
fb1f22c3520618689020ca52c389dffc,SERVOTECH,Bagging/Receiving of orders/contracts,24062025163533,https://nsearchives.nseindia.com/corporate/SERVOTECH_24062025163235_NSE_MP.pdf,Servotech Renewable Power System Limited,INE782X01017,2025-06-24 16:35:33,2025-06-24 16:35:33,,,,Servotech Renewable Power System Limited has informed the Exchange about Bagging/Receiving of orders/contracts,,,,24-Jun-2025 16:35:34,00:00:01,375 KB
cdc002181ca8e35a90e324ae8fa28bd7,MOTOGENFIN,Trading Window-XBRL,24062025163546,https://nsearchives.nseindia.com/corporate/xbrl/CLOSURE_TRADING_WINDOW_1470331_24062025043545_WEB.xml,The Motor & General Finance Limited,INE861B01015,2025-06-24 16:35:46,2025-06-24 16:35:46,,Finance,,THE MOTOR & GENERAL FINANCE LIMITED has informed the Exchange about Closure of Trading Window,,,,24-Jun-2025 16:35:47,00:00:01,2 KB
cc6aa7c7e86d2e74a6300c2d1d7cf6b4,SANDHAR,Update-Acquisition/Scheme/Sale/Disposal-XBRL,24062025163615,https://nsearchives.nseindia.com/corporate/xbrl/REG30_Restructuring_1470333_24062025043614_WEB.xml,Sandhar Technologies Limited,INE278H01035,2025-06-24 16:36:15,2025-06-24 16:36:15,,,,SANDHAR TECHNOLOGIES LIMITED has informed the Exchange regarding Update-Acquisition/Scheme/Sale/Disposal-XBRL,,,,24-Jun-2025 16:36:16,00:00:01,3 KB
e45c6a50319d64a39b1947e30fcd38ef,ASTRAL,Copy of Newspaper Publication,24062025163642,https://nsearchives.nseindia.com/corporate/ASTRAL_24062025163619_STOCKEXCHANGE.pdf,Astral Limited,INE006I01012,2025-06-24 16:36:42,2025-06-24 16:36:42,,Plastic And Plastic Products,,Astral Limited has informed the Exchange about Copy of Newspaper Publication regarding Transfer of Equity Shares to Investor Education Protection Fund (IEPF),,,,24-Jun-2025 16:36:43,00:00:01,5.64 MB
8165a719cc4ec55314c5490114b9b5f9,BAFNAPH,Retirement,24062025163840,https://nsearchives.nseindia.com/corporate/BAFNAPH_24062025163652_Disclosure_Under_Reg_30_Retirement_of_PKS.pdf,Bafna Pharmaceuticals Limited,INE878I01022,2025-06-24 16:38:40,2025-06-24 16:38:40,,,,"Bafna Pharmaceuticals Limited has informed the Exchange about the retirement of Mr. Palamadai Krishnan Sundaresan (DIN: 06954189) as an Independent Director of the Company upon completion of his first term, with effect from June 24, 2025.",,,,24-Jun-2025 16:38:40,00:00:00,794 KB
29bbb52611ed6d24f0c42ecb25f20653,BAFNAPH,General Updates,24062025163840,https://nsearchives.nseindia.com/corporate/BAFNAPH_24062025163636_Disclosure_Under_Reg_30_Retirement_of_PKS.pdf,Bafna Pharmaceuticals Limited,INE878I01022,2025-06-24 16:38:40,2025-06-24 16:38:40,,,,"Bafna Pharmaceuticals Limited has informed the Exchange about the re-constitution of the Audit Committee, Nomination-Remuneration Committee of the Board w.e.f June 25, 2025",,,,24-Jun-2025 16:38:41,00:00:01,794 KB
0bbd6bffab05e9bee8743e5c6531f7ae,MOTOGENFIN,Trading Window,24062025163913,https://nsearchives.nseindia.com/corporate/MOTOGENFIN_24062025163823_501343_24062025.pdf,The Motor & General Finance Limited,INE861B01015,2025-06-24 16:39:13,2025-06-24 16:39:13,,Finance,,"The Motor & General Finance Limited has informed the Exchange regarding the Trading Window closure pursuant to SEBI (Prohibition of Insider Trading) Regulations, 2015",,,,24-Jun-2025 16:39:14,00:00:01,183 KB
8a3a5f9db4b2a52e9ea85fd0fa58247c,CARERATING,Analysts/Institutional Investor Meet/Con. Call Updates,24062025164032,https://nsearchives.nseindia.com/corporate/CARERATINGS_24062025164002_CARE.pdf,CARE Ratings Limited,INE752H01013,2025-06-24 16:40:32,2025-06-24 16:40:32,,Finance,,CARE Ratings Limited has informed the Exchange about Schedule of meet,,,,24-Jun-2025 16:40:33,00:00:01,2.65 MB
604c31c198552976525e969b55530947,GNFC,Analysts/Institutional Investor Meet/Con. Call Updates,24062025164148,https://nsearchives.nseindia.com/corporate/rajeshpillai8741_24062025164000_SELTR_InvestorMeet_Intimation_Signed.pdf,Gujarat Narmada Valley Fertilizers and Chemicals Limited,INE113A01013,2025-06-24 16:41:48,2025-06-24 16:41:48,,Fertilisers,,Gujarat Narmada Valley Fertilizers and Chemicals Limited has informed the Exchange about Schedule of meet,,,,24-Jun-2025 16:41:48,00:00:00,238 KB
9badd8eaa61a9f45e19c005a105550f1,ZFCVINDIA,Trading Window,24062025164209,https://nsearchives.nseindia.com/corporate/WABCOINDIA_24062025164004_SdSETradingwindow.pdf,ZF Commercial Vehicle Control Systems India Limited,INE342J01019,2025-06-24 16:42:09,2025-06-24 16:42:09,,,,"ZF Commercial Vehicle Control Systems India Limited has informed the Exchange regarding the Trading Window closure pursuant to SEBI (Prohibition of Insider Trading) Regulations, 2015",,,,24-Jun-2025 16:42:10,00:00:01,206 KB
f609df7022712cfe5987b80214f8fcfc,PERSISTENT,Board Meeting Intimation,24062025164336,https://nsearchives.nseindia.com/corporate/xbrl/PRIOR_INTIMATION_58344_1470349_24062025044336_WEB.xml,Persistent Systems Limited,INE262H01013,2025-06-24 16:43:36,2025-06-24 16:43:36,,Computers - Software,,PERSISTENT SYSTEMS LIMITED has informed the Exchange about Board Meeting to be held on 23-Jul-2025 to inter-alia consider and approve the Audited Financial results of the Company for the Quarterly ended June 2025 .,,,,24-Jun-2025 16:43:38,00:00:02,2 KB
62ae5ec56af1004c634eedb7638021c0,ZFCVINDIA,Trading Window-XBRL,24062025164350,https://nsearchives.nseindia.com/corporate/xbrl/CLOSURE_TRADING_WINDOW_1470350_24062025044349_WEB.xml,ZF Commercial Vehicle Control Systems India Limited,INE342J01019,2025-06-24 16:43:50,2025-06-24 16:43:50,,,,ZF COMMERCIAL VEHICLE CONTROL SYSTEMS INDIA LIMITED has informed the Exchange about Closure of Trading Window,,,,24-Jun-2025 16:43:51,00:00:01,2 KB
9f7a82bc3e0e4351bcc3dde40684a3b1,KRN,Analysts/Institutional Investor Meet/Con. Call Updates,24062025164405,https://nsearchives.nseindia.com/corporate/KRNHEAT_24062025164354_investorcallintimationsigned.pdf,KRN Heat Exchanger and Refrigeration Limited,INE0Q3J01015,2025-06-24 16:44:05,2025-06-24 16:44:05,,,,KRN Heat Exchanger and Refrigeration Limited has informed the Exchange about Schedule of meet,,,,24-Jun-2025 16:44:06,00:00:01,266 KB
64d282acda92b4e1eea1ea151fd73933,PNBHOUSING,Analysts/Institutional Investor Meet/Con. Call Updates,24062025164413,https://nsearchives.nseindia.com/corporate/PNBHOUSING_24062025164149_Outcome_Nirmal_Bang__June24_Fsd.pdf,PNB Housing Finance Limited,INE572E01012,2025-06-24 16:44:13,2025-06-24 16:44:13,,,,PNB Housing Finance Limited has informed the Exchange about Schedule of Investor Meeting -Outcome,,,,24-Jun-2025 16:44:13,00:00:00,271 KB
e65dd84ab078674a99b5d87497897f7d,PERSISTENT,Trading Window-XBRL,24062025164449,https://nsearchives.nseindia.com/corporate/xbrl/CLOSURE_TRADING_WINDOW_1470353_24062025044448_WEB.xml,Persistent Systems Limited,INE262H01013,2025-06-24 16:44:49,2025-06-24 16:44:49,,Computers - Software,,PERSISTENT SYSTEMS LIMITED has informed the Exchange about Closure of Trading Window,,,,24-Jun-2025 16:44:50,00:00:01,2 KB
d575e13acbc76187923e6f453f460098,HARSHA,Trading Window,24062025164500,https://nsearchives.nseindia.com/corporate/Harsha_24062025164432_TradingWindowClosureQ1FY2026.pdf,Harsha Engineers International Limited,INE0JUS01029,2025-06-24 16:45:00,2025-06-24 16:45:00,,,,"Harsha Engineers International Limited has informed the Exchange regarding the Trading Window closure pursuant to SEBI (Prohibition of Insider Trading) Regulations, 2015",,,,24-Jun-2025 16:45:01,00:00:01,430 KB
a14b3f4fdf81a293b518a1fb70f97cc8,GOCOLORS,Trading Window,24062025164514,https://nsearchives.nseindia.com/corporate/GOCOLORS_24062025164417_TradingWindowclosureupload.pdf,Go Fashion (India) Limited,INE0BJS01011,2025-06-24 16:45:14,2025-06-24 16:45:14,,,,"Go Fashion (India) Limited has informed the Exchange regarding the Trading Window closure pursuant to SEBI (Prohibition of Insider Trading) Regulations, 2015",,,,24-Jun-2025 16:45:15,00:00:01,583 KB
d8c06b1f25d83709e64c86f1b3468e9d,RETAIL,Trading Window,24062025164549,https://nsearchives.nseindia.com/corporate/RETAIL_24062025164436_TradingWindowClosure.pdf,JHS Svendgaard Retail Ventures Limited,INE03DD01011,2025-06-24 16:45:49,2025-06-24 16:45:49,,,,"JHS Svendgaard Retail Ventures Limited has informed the Exchange regarding the Trading Window closure pursuant to SEBI (Prohibition of Insider Trading) Regulations, 2015",,,,24-Jun-2025 16:45:51,00:00:02,519 KB
484bf2dfef72e347257a282e8fb0d8f8,HARSHA,Trading Window-XBRL,24062025164550,https://nsearchives.nseindia.com/corporate/xbrl/CLOSURE_TRADING_WINDOW_1470354_24062025044550_WEB.xml,Harsha Engineers International Limited,INE0JUS01029,2025-06-24 16:45:50,2025-06-24 16:45:50,,,,Harsha Engineers International Limited has informed the Exchange about Closure of Trading Window,,,,24-Jun-2025 16:45:52,00:00:02,2 KB
7a7b47f2f1eea7abc1ae4a3c32e1fa06,TAINWALCHM,Trading Window,24062025164602,https://nsearchives.nseindia.com/corporate/TAINWALCHM_24062025163805_Trading_Window_Closure_TCPL_June25_Sd.pdf,Tainwala Chemical and Plastic (I) Limited,INE123C01018,2025-06-24 16:46:02,2025-06-24 16:46:02,,Plastic And Plastic Products,,"Tainwala Chemical and Plastic (I) Limited has informed the Exchange regarding the Trading Window closure pursuant to SEBI (Prohibition of Insider Trading) Regulations, 2015",,,,24-Jun-2025 16:46:05,00:00:03,539 KB
b1853d026fc7e3a868eb1d91f737b12f,ZODIAC,Trading Window,24062025164608,https://nsearchives.nseindia.com/corporate/ZODIAC_24062025164549_Trading_Window_Closure_signed.pdf,Zodiac Energy Limited,INE761Y01019,2025-06-24 16:46:08,2025-06-24 16:46:08,,,,"Zodiac Energy Limited has informed the Exchange regarding the Trading Window closure pursuant to SEBI (Prohibition of Insider Trading) Regulations, 2015",,,,24-Jun-2025 16:46:09,00:00:01,571 KB
734c157c44895911e72fea48d9501c6e,SERVOTECH,Press Release,24062025164628,https://nsearchives.nseindia.com/corporate/SERVOTECH_24062025164240_MPPRESSRELEASE.pdf,Servotech Renewable Power System Limited,INE782X01017,2025-06-24 16:46:28,2025-06-24 16:46:28,,,,"Servotech Renewable Power System Limited has informed the Exchange regarding a press release dated Jun 24, 2025, titled ""Servotech Secures Approx 16 MW On-Grid Solar Rooftop Project from Madhya Pradesh Urja Vikas Nigam Ltd."".",,,,24-Jun-2025 16:46:29,00:00:01,981 KB
dfa1427431a6921218087b6cd572544c,DIGISPICE,Trading Window,24062025164636,https://nsearchives.nseindia.com/corporate/DIGISPICE_24062025164540_TradingWindowClosureJune25s.pdf,DiGiSPICE Technologies Limited,INE927C01020,2025-06-24 16:46:36,2025-06-24 16:46:36,,,,"DiGiSPICE Technologies Limited has informed the Exchange regarding the Trading Window closure pursuant to SEBI (Prohibition of Insider Trading) Regulations, 2015",,,,24-Jun-2025 16:46:37,00:00:01,217 KB
bb544eb32270c3b54e3ceebfe6053fa0,TERASOFT,Trading Window,24062025164641,https://nsearchives.nseindia.com/corporate/TERASOFT_24062025164628_ClosureOfTradingWindow.pdf,Tera Software Limited,INE482B01010,2025-06-24 16:46:41,2025-06-24 16:46:41,,,,"Tera Software Limited has informed the Exchange regarding the Trading Window closure pursuant to SEBI (Prohibition of Insider Trading) Regulations, 2015",,,,24-Jun-2025 16:46:43,00:00:02,676 KB
802e74b6cc78addd268a582e6c59dc43,RETAIL,Trading Window-XBRL,24062025164702,https://nsearchives.nseindia.com/corporate/xbrl/CLOSURE_TRADING_WINDOW_1470355_24062025044701_WEB.xml,JHS Svendgaard Retail Ventures Limited,INE03DD01011,2025-06-24 16:47:02,2025-06-24 16:47:02,,,,JHS SVENDGAARD RETAIL VENTURES LIMITED has informed the Exchange about Closure of Trading Window,,,,24-Jun-2025 16:47:03,00:00:01,2 KB
c764b5ccf57fb3446251eb63a4473bcb,DIGISPICE,Trading Window-XBRL,24062025164748,https://nsearchives.nseindia.com/corporate/xbrl/CLOSURE_TRADING_WINDOW_1470357_24062025044747_WEB.xml,DiGiSPICE Technologies Limited,INE927C01020,2025-06-24 16:47:48,2025-06-24 16:47:48,,,,DIGISPICE TECHNOLOGIES LIMITED has informed the Exchange about Closure of Trading Window,,,,24-Jun-2025 16:47:49,00:00:01,2 KB
78fb570a4f08342f413d7587fcc32bf9,GOCOLORS,Trading Window-XBRL,24062025164753,https://nsearchives.nseindia.com/corporate/xbrl/CLOSURE_TRADING_WINDOW_1470358_24062025044753_WEB.xml,Go Fashion (India) Limited,INE0BJS01011,2025-06-24 16:47:53,2025-06-24 16:47:53,,,,GO FASHION (INDIA) LIMITED has informed the Exchange about Closure of Trading Window,,,,24-Jun-2025 16:47:54,00:00:01,2 KB
b1325b49a99daa80c7ce0b208535357a,TERASOFT,Trading Window-XBRL,24062025164840,https://nsearchives.nseindia.com/corporate/xbrl/CLOSURE_TRADING_WINDOW_1470359_24062025044839_WEB.xml,Tera Software Limited,INE482B01010,2025-06-24 16:48:40,2025-06-24 16:48:40,,,,TERA SOFTWARE LIMITED has informed the Exchange about Closure of Trading Window,,,,24-Jun-2025 16:48:41,00:00:01,2 KB
cb70bae65a33553cc34b40d2de4cb6be,ZODIAC,Trading Window-XBRL,24062025164859,https://nsearchives.nseindia.com/corporate/xbrl/CLOSURE_TRADING_WINDOW_1470360_24062025044858_WEB.xml,Zodiac Energy Limited,INE761Y01019,2025-06-24 16:48:59,2025-06-24 16:48:59,,,,ZODIAC ENERGY LIMITED has informed the Exchange about Closure of Trading Window,,,,24-Jun-2025 16:49:00,00:00:01,2 KB
a80583236fd554a660d7300c54faafd4,TERASOFT,Trading Window-XBRL,24062025164906,https://nsearchives.nseindia.com/corporate/xbrl/CLOSURE_TRADING_WINDOW_1470361_24062025044905_WEB.xml,Tera Software Limited,INE482B01010,2025-06-24 16:49:06,2025-06-24 16:49:06,,,,TERA SOFTWARE LIMITED has informed the Exchange about Closure of Trading Window,,,,24-Jun-2025 16:49:07,00:00:01,2 KB
f42156d7d73baa3c880d98479ada7e86,IDEA,News Verification,24062025164957,https://nsearchives.nseindia.com/corporate/IDEA_24062025164910_SENewsClarification24062025s.pdf,Vodafone Idea Limited,INE669E01016,2025-06-24 16:49:57,2025-06-24 16:49:57,,Telecommunication - Services,,"The Exchange has sought clarification from Vodafone Idea Limited with respect to recent news item captioned Vodafone Idea shares jump over 7% on reports of govt considering relief on &#8377;84,000 crore dues.  The response from the Company is attached.",,,,24-Jun-2025 16:49:58,00:00:01,1.70 MB
d134729553b7d88b977e027961bc3fff,PERSISTENT,Notice Of Shareholders Meetings-XBRL,24062025165008,https://nsearchives.nseindia.com/corporate/xbrl/NOTICE_OF_SHAREHOLDERS_MEETINGS_1470362_24062025045008_WEB.xml,Persistent Systems Limited,INE262H01013,2025-06-24 16:50:08,2025-06-24 16:50:08,,Computers - Software,,PERSISTENT SYSTEMS LIMITED has informed the Exchange about Notice of Shareholders Meeting for Annual General Meeting to be held on 21-Jul-2025,,,,24-Jun-2025 16:50:10,00:00:02,20 KB
9f74fc0da7d215e000a7304c90692615,RUSHIL,Outcome of Board Meeting,24062025165138,https://nsearchives.nseindia.com/corporate/RUSHIL_24062025165049_Outcome_of_Meeting.pdf,Rushil Decor Limited,INE573K01017,2025-06-24 16:51:38,2025-06-24 16:51:38,,Construction,,"RUSHIL: Rushil Decor Limited has informed the Exchange regarding Outcome of Fund raising committee Meeting held on Jun 24, 2025.",,,,24-Jun-2025 16:51:39,00:00:01,464 KB
22c207dfd2d2953fa63b6a3ccdb7b6ab,SAMMAANCAP,Updates,24062025165247,https://nsearchives.nseindia.com/corporate/IHFL_24062025165224_SCL_Exchange_Retail_intimation_57_24062025.pdf,Sammaan Capital Limited,INE148I01020,2025-06-24 16:52:47,2025-06-24 16:52:47,,,,"Sammaan Capital Limited has informed the Exchange regarding 'Pursuant to Regulations 30 and 57 of Securities and Exchange Board of India (Listing Obligations and Disclosure Requirements) Regulations, 2015, we hereby certify that our Company has made timely payment of interest in respect of the following Secured Redeemable Non-convertible Debentures and Unsecured Redeemable Non-Convertible Debentures issued by our Company, through Public Issue, and listed on the Stock Exchange.For details, refer attachment.'.",,,,24-Jun-2025 16:52:47,00:00:00,504 KB
6c81045464b92fa2eaf102e4839c28dd,AUROPHARMA,Updates,24062025165249,https://nsearchives.nseindia.com/corporate/AUROPHARMA_24062025165154_LtrToSEsCurateq24062025.pdf,Aurobindo Pharma Limited,INE406A01029,2025-06-24 16:52:49,2025-06-24 16:52:49,,Pharmaceuticals,,Aurobindo Pharma Limited has informed the Exchange regarding 'CuraTeQ Biologics receives approval for biosimilar Dyrupeg from UK s MHRA'.,,,,24-Jun-2025 16:52:49,00:00:00,217 KB
2c0b7101512d74a4c169e0586f1b1238,KEI,Outcome of Board Meeting,24062025165501,https://nsearchives.nseindia.com/corporate/KEI_24062025165353_OutcomeofBM.pdf,KEI Industries Limited,INE878B01027,2025-06-24 16:55:01,2025-06-24 16:55:01,,Miscellaneous,,"KEI Industries Limited has informed the Exchange regarding Outcome of Board Meeting / Announcements pursuant to Regulation 30 of SEBI (Listing Obligations and Disclosure Requirements) Regulations, 2015",,,,24-Jun-2025 16:55:02,00:00:01,901 KB
74750bccddb1f26be9d36179c4eee020,CGPOWER,Updates,24062025165625,https://nsearchives.nseindia.com/corporate/CGPOWER_24062025165134_Disclosure_Regulation_30_LODR_24_06_2025.pdf,CG Power and Industrial Solutions Limited,INE067A01029,2025-06-24 16:56:25,2025-06-24 16:56:25,,,,CG Power and Industrial Solutions Limited has informed the Exchange regarding 'Disclosure under Regulation 30 of SEBI LODR'.,,,,24-Jun-2025 16:56:27,00:00:02,354 KB
6eaa7d15b1f770d2cb65dfd5980971f8,TAINWALCHM,Trading Window-XBRL,24062025165643,https://nsearchives.nseindia.com/corporate/xbrl/CLOSURE_TRADING_WINDOW_1470371_24062025045642_WEB.xml,Tainwala Chemical and Plastic (I) Limited,INE123C01018,2025-06-24 16:56:43,2025-06-24 16:56:43,,Plastic And Plastic Products,,TAINWALA CHEMICAL AND PLASTIC (I) LIMITED has informed the Exchange about Closure of Trading Window,,,,24-Jun-2025 16:56:44,00:00:01,3 KB
4c8bcf3e746018a0d730fcfc50f2c09a,VSTL,Outcome of Board Meeting,24062025165726,https://nsearchives.nseindia.com/corporate/VIBHOR_24062025165710_Outcome_of_BM_filed.pdf,Vibhor Steel Tubes Limited,INE0QTF01015,2025-06-24 16:57:26,2025-06-24 16:57:26,,,,"Vibhor Steel Tubes Limited has informed the Exchange regarding  Board meeting held on Jun 24, 2025.",,,,24-Jun-2025 16:57:27,00:00:01,4.85 MB
495c8479941b61d42e994287f080d0c1,RUSHIL,Allotment of Securities,24062025165801,https://nsearchives.nseindia.com/corporate/RUSHIL_24062025165724_Allotment_of_securities.pdf,Rushil Decor Limited,INE573K01017,2025-06-24 16:58:01,2025-06-24 16:58:01,,Construction,,"RUSHIL: Rushil Decor Limited has informed the Exchange regarding allotment of 6600000 equity shares of Rs. 1 each on conversion of warrants pursuant to Preferential Issue at its meeting held on Jun 24, 2025.",,,,24-Jun-2025 16:58:02,00:00:01,540 KB
36f76d4214397bcd3466bd3010e2081d,DALBHARAT,General Updates,24062025165906,https://nsearchives.nseindia.com/corporate/DALBHARAT_24062025165239_SEBI_LODR_DCBL-240625.pdf,Dalmia Bharat Limited,INE00R701025,2025-06-24 16:59:06,2025-06-24 16:59:06,,,,Dalmia Bharat Limited has informed the Exchange about General Updates,,,,24-Jun-2025 16:59:07,00:00:01,847 KB
202aee091a884141f2926b59319a7f49,AWFIS,Trading Window,24062025170001,https://nsearchives.nseindia.com/corporate/AWFIS2014_24062025165912_Trading_Window_Closure.pdf,Awfis Space Solutions Limited,INE108V01019,2025-06-24 17:00:01,2025-06-24 17:00:01,,,,"Awfis Space Solutions Limited has informed the Exchange regarding the Trading Window closure pursuant to SEBI (Prohibition of Insider Trading) Regulations, 2015",,,,24-Jun-2025 17:00:02,00:00:01,211 KB
349354c781c782a95e208955a7123086,IGPL,Trading Window,24062025170239,https://nsearchives.nseindia.com/corporate/IGPL_24062025170014_ClosureofTW.pdf,IG Petrochemicals Limited,INE204A01010,2025-06-24 17:02:39,2025-06-24 17:02:39,,Petrochemicals,,"IG Petrochemicals Limited has informed the Exchange regarding the Trading Window closure pursuant to SEBI (Prohibition of Insider Trading) Regulations, 2015",,,,24-Jun-2025 17:02:39,00:00:00,2.95 MB
7ebfa78f4e86893f72f1eb32d062d016,VERANDA,Updates,24062025170331,https://nsearchives.nseindia.com/corporate/Verandaipo_24062025170157_FS.pdf,Veranda Learning Solutions Limited,INE0IQ001011,2025-06-24 17:03:31,2025-06-24 17:03:31,,,,"Veranda Learning Solutions Limited has informed the Exchange regarding Audited Financial Statements (Standalone and Consolidated) for the financial year ended March 31, 2025.",,,,24-Jun-2025 17:03:32,00:00:01,27.22 MB
ea559bc1e810ace78c05d1b3b6cd1037,ADOR,Record Date,24062025170346,https://nsearchives.nseindia.com/corporate/ADORWELD_24062025170212_reg42intimation.pdf,Ador Welding Limited,INE045A01017,2025-06-24 17:03:46,2025-06-24 17:03:46,,,,Ador Welding Limited has informed the Exchange that Record date for the purpose of Dividend  is 08-Jul-2025.,,,,24-Jun-2025 17:03:47,00:00:01,2.13 MB
a391139b2541785dee97ea0f76801c68,PRICOLLTD,Trading Window,24062025170349,https://nsearchives.nseindia.com/corporate/PRICOLLTD_24062025170340_closureoftradingwindowjun25.pdf,Pricol Limited,INE726V01018,2025-06-24 17:03:49,2025-06-24 17:03:49,,,,"Pricol Limited has informed the Exchange regarding the Trading Window closure pursuant to SEBI (Prohibition of Insider Trading) Regulations, 2015",,,,24-Jun-2025 17:03:50,00:00:01,314 KB
3dc67e696b63333e4ebf7b5e5308d92e,PRICOLLTD,Trading Window-XBRL,24062025170455,https://nsearchives.nseindia.com/corporate/xbrl/CLOSURE_TRADING_WINDOW_1470384_24062025050455_WEB.xml,Pricol Limited,INE726V01018,2025-06-24 17:04:55,2025-06-24 17:04:55,,,,PRICOL LIMITED has informed the Exchange about Closure of Trading Window,,,,24-Jun-2025 17:04:57,00:00:02,2 KB
3467e6e68fbaec7fb9ecc0692daa42c8,ITDCEM,Pendency of Litigation(s)/dispute(s) or the outcome impacting the Company,24062025170547,https://nsearchives.nseindia.com/corporate/ITD_24062025170535_SE_intimation_Insta_Concretex_24062025_v2_Clean_Signed.pdf,ITD Cementation India Limited,INE686A01018,2025-06-24 17:05:47,2025-06-24 17:05:47,,Construction,,ITD Cementation India Limited has informed the Exchange about Pendency of Litigation(s)/dispute(s) or the outcome impacting the Company,,,,24-Jun-2025 17:05:48,00:00:01,1.72 MB
86f876f8c4ec79d11f12a5f4a717255a,RUSHIL,Forfeiture,24062025170627,https://nsearchives.nseindia.com/corporate/RUSHIL_24062025170113_Forfeiture_of_warrants.pdf,Rushil Decor Limited,INE573K01017,2025-06-24 17:06:27,2025-06-24 17:06:27,,Construction,,RUSHIL: Rushil Decor Limited has informed the Exchange about Forfeiture due to non-exercise of option on conversion of warrants.,,,,24-Jun-2025 17:06:28,00:00:01,502 KB
